{
  "$schema": "../schemas/rhino-commerce-sku-registry.schema.json",
  "schemaVersion": 1,
  "source": {
    "title": "Rhino Lapidary governed commerce SKU registry",
    "authorityKind": "human_owned",
    "owner": "Rhino Lapidary Product Data / Product Owner",
    "operationsRole": "downstream_consumer",
    "initializedAt": "2026-09-04",
    "initialProposalMethod": "one-time deterministic ordering by immutable Shopify Variant GID",
    "regenerationPolicy": "never_rebuild_allocations_from_catalog_sorting"
  },
  "authorityDecisionId": "PO-E-040",
  "schemeDecisionId": "PO-E-041",
  "approvalState": "architecture_approved_values_proposed",
  "scheme": {
    "format": "RH-######",
    "scope": "shopify_variant_sellable_commerce_unit",
    "allocationRule": "next_unused_identifier_from_governed_registry_only",
    "nextAvailableSequence": 122,
    "uniqueness": "case_insensitive_across_active_and_retired",
    "immutability": "immutable_after_approval_except_governed_correction_or_migration",
    "retiredIdentifiers": "never_reuse",
    "prohibitedEncoding": [
      "product_class",
      "vendor",
      "machine_family",
      "voltage",
      "grit",
      "size",
      "compatibility",
      "dimensions",
      "shopify_numeric_id",
      "handle",
      "title",
      "technical_spec",
      "sort_position"
    ],
    "arbitraryAgentGenerationProhibited": true,
    "legacyIdentifiers": "preserve_as_aliases_and_history",
    "shopifyGids": "platform_identity_not_commerce_sku",
    "variantRestructure": "requires_explicit_mapping_decision"
  },
  "allocations": [
    {
      "sku": "RH-000001",
      "variantGid": "gid://shopify/ProductVariant/46484249903301",
      "productGid": "gid://shopify/Product/8905778331845",
      "currentHandleForReview": "bonded-diamond-wheel-220",
      "currentTitleForReview": "6 in Bonded Diamond Wheel, 220 grit",
      "issuanceState": "proposed",
      "issuedAt": null,
      "issuedBy": null,
      "decisionOwner": "Rhino Lapidary Product Data / Product Owner",
      "legacyIdentifiers": [],
      "replacedOrRetiredSkuHistory": [],
      "sourceDecision": "PO-E-041",
      "notesOrBlocker": "Initial deterministic proposal reserved in the governed registry. This value is not authoritative or approved for Shopify population until its issuanceState is approved."
    },
    {
      "sku": "RH-000002",
      "variantGid": "gid://shopify/ProductVariant/46484250001605",
      "productGid": "gid://shopify/Product/8905778430149",
      "currentHandleForReview": "bonded-diamond-wheel-80",
      "currentTitleForReview": "6 in Bonded Diamond Wheel, 80 grit",
      "issuanceState": "proposed",
      "issuedAt": null,
      "issuedBy": null,
      "decisionOwner": "Rhino Lapidary Product Data / Product Owner",
      "legacyIdentifiers": [],
      "replacedOrRetiredSkuHistory": [],
      "sourceDecision": "PO-E-041",
      "notesOrBlocker": "Initial deterministic proposal reserved in the governed registry. This value is not authoritative or approved for Shopify population until its issuanceState is approved."
    },
    {
      "sku": "RH-000003",
      "variantGid": "gid://shopify/ProductVariant/46484250067141",
      "productGid": "gid://shopify/Product/8905778495685",
      "currentHandleForReview": "hard-buffing-wheel",
      "currentTitleForReview": "6 in Hard Buffing Wheel",
      "issuanceState": "proposed",
      "issuedAt": null,
      "issuedBy": null,
      "decisionOwner": "Rhino Lapidary Product Data / Product Owner",
      "legacyIdentifiers": [],
      "replacedOrRetiredSkuHistory": [],
      "sourceDecision": "PO-E-041",
      "notesOrBlocker": "Initial deterministic proposal reserved in the governed registry. This value is not authoritative or approved for Shopify population until its issuanceState is approved."
    },
    {
      "sku": "RH-000004",
      "variantGid": "gid://shopify/ProductVariant/46484252262597",
      "productGid": "gid://shopify/Product/8905778561221",
      "currentHandleForReview": "magnetic-felt-pad",
      "currentTitleForReview": "6 in Magnetic Felt Pad",
      "issuanceState": "proposed",
      "issuedAt": null,
      "issuedBy": null,
      "decisionOwner": "Rhino Lapidary Product Data / Product Owner",
      "legacyIdentifiers": [],
      "replacedOrRetiredSkuHistory": [],
      "sourceDecision": "PO-E-041",
      "notesOrBlocker": "Initial deterministic proposal reserved in the governed registry. This value is not authoritative or approved for Shopify population until its issuanceState is approved."
    },
    {
      "sku": "RH-000005",
      "variantGid": "gid://shopify/ProductVariant/46484252459205",
      "productGid": "gid://shopify/Product/8905778659525",
      "currentHandleForReview": "magnetic-hard-disc",
      "currentTitleForReview": "6 in Magnetic Hard Disc, 80 grit",
      "issuanceState": "proposed",
      "issuedAt": null,
      "issuedBy": null,
      "decisionOwner": "Rhino Lapidary Product Data / Product Owner",
      "legacyIdentifiers": [],
      "replacedOrRetiredSkuHistory": [],
      "sourceDecision": "PO-E-041",
      "notesOrBlocker": "Initial deterministic proposal reserved in the governed registry. This value is not authoritative or approved for Shopify population until its issuanceState is approved."
    },
    {
      "sku": "RH-000006",
      "variantGid": "gid://shopify/ProductVariant/46484252655813",
      "productGid": "gid://shopify/Product/8905778757829",
      "currentHandleForReview": "magnetic-resin-disc-220",
      "currentTitleForReview": "6 in Magnetic Resin Bond Disc, 220 grit",
      "issuanceState": "proposed",
      "issuedAt": null,
      "issuedBy": null,
      "decisionOwner": "Rhino Lapidary Product Data / Product Owner",
      "legacyIdentifiers": [],
      "replacedOrRetiredSkuHistory": [],
      "sourceDecision": "PO-E-041",
      "notesOrBlocker": "Initial deterministic proposal reserved in the governed registry. This value is not authoritative or approved for Shopify population until its issuanceState is approved."
    },
    {
      "sku": "RH-000007",
      "variantGid": "gid://shopify/ProductVariant/46484252721349",
      "productGid": "gid://shopify/Product/8905778823365",
      "currentHandleForReview": "magnetic-resin-disc-600",
      "currentTitleForReview": "6 in Magnetic Resin Bond Disc, 600 grit",
      "issuanceState": "proposed",
      "issuedAt": null,
      "issuedBy": null,
      "decisionOwner": "Rhino Lapidary Product Data / Product Owner",
      "legacyIdentifiers": [],
      "replacedOrRetiredSkuHistory": [],
      "sourceDecision": "PO-E-041",
      "notesOrBlocker": "Initial deterministic proposal reserved in the governed registry. This value is not authoritative or approved for Shopify population until its issuanceState is approved."
    },
    {
      "sku": "RH-000008",
      "variantGid": "gid://shopify/ProductVariant/46484252754117",
      "productGid": "gid://shopify/Product/8905778888901",
      "currentHandleForReview": "screw-on-flat-lap",
      "currentTitleForReview": "6 in Metal Screw-On Flat Lap",
      "issuanceState": "proposed",
      "issuedAt": null,
      "issuedBy": null,
      "decisionOwner": "Rhino Lapidary Product Data / Product Owner",
      "legacyIdentifiers": [],
      "replacedOrRetiredSkuHistory": [],
      "sourceDecision": "PO-E-041",
      "notesOrBlocker": "Initial deterministic proposal reserved in the governed registry. This value is not authoritative or approved for Shopify population until its issuanceState is approved."
    },
    {
      "sku": "RH-000009",
      "variantGid": "gid://shopify/ProductVariant/46484252819653",
      "productGid": "gid://shopify/Product/8905778921669",
      "currentHandleForReview": "resin-diamond-wheel-1200",
      "currentTitleForReview": "6 in Resin Bond Diamond Wheel, 1200 grit",
      "issuanceState": "proposed",
      "issuedAt": null,
      "issuedBy": null,
      "decisionOwner": "Rhino Lapidary Product Data / Product Owner",
      "legacyIdentifiers": [],
      "replacedOrRetiredSkuHistory": [],
      "sourceDecision": "PO-E-041",
      "notesOrBlocker": "Initial deterministic proposal reserved in the governed registry. This value is not authoritative or approved for Shopify population until its issuanceState is approved."
    },
    {
      "sku": "RH-000010",
      "variantGid": "gid://shopify/ProductVariant/46484252885189",
      "productGid": "gid://shopify/Product/8905778987205",
      "currentHandleForReview": "resin-diamond-wheel-280",
      "currentTitleForReview": "6 in Resin Bond Diamond Wheel, 280 grit",
      "issuanceState": "proposed",
      "issuedAt": null,
      "issuedBy": null,
      "decisionOwner": "Rhino Lapidary Product Data / Product Owner",
      "legacyIdentifiers": [],
      "replacedOrRetiredSkuHistory": [],
      "sourceDecision": "PO-E-041",
      "notesOrBlocker": "Initial deterministic proposal reserved in the governed registry. This value is not authoritative or approved for Shopify population until its issuanceState is approved."
    },
    {
      "sku": "RH-000011",
      "variantGid": "gid://shopify/ProductVariant/46484252950725",
      "productGid": "gid://shopify/Product/8905779052741",
      "currentHandleForReview": "resin-diamond-wheel-3000",
      "currentTitleForReview": "6 in Resin Bond Diamond Wheel, 3000 grit",
      "issuanceState": "proposed",
      "issuedAt": null,
      "issuedBy": null,
      "decisionOwner": "Rhino Lapidary Product Data / Product Owner",
      "legacyIdentifiers": [],
      "replacedOrRetiredSkuHistory": [],
      "sourceDecision": "PO-E-041",
      "notesOrBlocker": "Initial deterministic proposal reserved in the governed registry. This value is not authoritative or approved for Shopify population until its issuanceState is approved."
    },
    {
      "sku": "RH-000012",
      "variantGid": "gid://shopify/ProductVariant/46484253016261",
      "productGid": "gid://shopify/Product/8905779118277",